hello,Xin chàoo
tôi có phải là đối tượng được chuyển đổi không,"Khối công nghệ hạ tầng, FHR, FCC, FTC của FPT Telecom sẽ tiên phong chuyển đổi thử nghiệm từ Office 365 sang Google Workspace. Việc sử dụng Google Workspace là cơ sở để ban điều hành quyết định có chuyển đổi toàn bộ sang sử dụng nền tảng office mới trên Google hay không. Vì vậy đề nghị mọi người sử dụng hệ thống mới ngay sau khi được cấp account."
tôi không rõ như thế nào là email của năm 2023,Email của năm 2023 là những email được gửi/nhận tính từ ngày 1/1/2023 đến hiện tại. Những email này sẽ được chuyển trước sang account fpt.com trước. Những email từ ngày 1/1/2023 trở về trước sẽ được chuyển sang account fpt.com sau khi account mới đã được bàn giao đến anh/chị.
Các ứng dụng hiện tại đang không đăng nhập được trong đó có VPN?,"Việc login VPN bằng account fpt.com hiện tại chưa sẵn sàng, vui lòng đăng nhập VPN bằng account cũ cho đến khi có thông báo mới."
làm thế nào để chuyển dữ liệu sharepoint?,"Các site Sharepoint sẽ không được chuyển đổi dữ liệu tự động. Admin của site cần chủ động thực hiện backup/restore dữ liệu sang site Sharepoint mới. Hướng dẫn chi tiết chuyển đổi Sharepoint, vui lòng xem ở đây: https://foxnews.fpt.vn/huong-dan-sao-luu-va-dong-bo-du-lieu-cong-cu-sharepoint/ Trong thời gian chưa chuyển đổi, người dùng tiếp tục dùng tài khoản cũ (@fpt.com.vn) để truy cập vào Sharepoint. Admin của các site Sharepoint có dữ liệu lớn cần hỗ trợ chuyển đổi có thể liên hệ bộ phận IT để được giúp đỡ."
Tôi muốn logout ra khỏi single sign on thì làm thế nào?," Truy cập link sau (lưu ý: trên iPhone phải dùng Safari, trên Android dùng trình duyệt mặc định) để sign-out khỏi account cũ (fpt.com.vn) và đăng nhập lại bằng account mới
https://login.microsoftonline.com/logout.srf"
Tôi không đổi được pass email?,"Vui lòng đọc kỹ email thông báo từ HR, và hướng dẫn đổi pass tại https://ess.fpt.com/. Bạn có thể tham khảo thêm tại: https://foxnews.fpt.vn/video-huong-dan-doi-mat-khau/"
Làm sao đăng nhập được workchat?,"Hướng dẫn login Workplace/Workchat bằng account mới:

- Khi nhận được email fpt.com là bạn sẽ bị phải login Workchat/Workplace bằng account mới
- Bạn mở trình duyệt và truy nhập vào https://office.com/
- Bấm vào avatar của bạn ở góc trên bên phải, chọn ""Sign in with a different account"" > “Use another account” để đăng nhập thêm account mới
- Bạn sẽ log in bằng account mới thành công
- Bạn mở tab mới trên trình duyệt web đó, truy nhập vào https://fpt.workplace.com/ để đăng nhập với account mới
Dữ liệu WorkChat là nội dung chat sẽ được chuyển tự động và gán đúng cho user account mới của từng người. Về cơ bản, user chỉ thay đổi xác thực bằng account email mới, dữ liệu chat vẫn được giữ nguyên.

Nếu vẫn gặp khó khăn trong quá trình login Workchat trên điện thoại, bạn có thể thử:
- Truy cập link sau (lưu ý: trên iPhone phải dùng Safari, trên Android dùng trình duyệt mặc định) để sign-out khỏi account cũ (fpt.com.vn) và đăng nhập lại bằng account mới
https://login.microsoftonline.com/logout.srf"
Em không đổi được pass theo hướng dẫn trên trang https://ess.fpt.com/,"Vui lòng đọc kỹ email thông báo từ HR, và hướng dẫn đổi pass tại https://ess.fpt.com/. Bạn có thể tham khảo thêm tại: https://foxnews.fpt.vn/video-huong-dan-doi-mat-khau/"
Vậy thì em vẫn dùng lại mật khẩu cũ ạ,"Vui lòng đọc kỹ email thông báo từ HR, và hướng dẫn đổi pass tại https://ess.fpt.com/. Bạn có thể tham khảo thêm tại: https://foxnews.fpt.vn/video-huong-dan-doi-mat-khau/"
Em không đổi được mật khẩu theo hướng dẫn ạ,"Vui lòng đọc kỹ email thông báo từ HR, và hướng dẫn đổi pass tại https://ess.fpt.com/. Bạn có thể tham khảo thêm tại: https://foxnews.fpt.vn/video-huong-dan-doi-mat-khau/"
reset pass mail mới như nào?,Vui lòng liên hệ admin/HCNS của đơn vị mở ticket reset mật khẩu trên uService
Đổi mật khẩu email mới như nào ?,"Vui lòng đọc kỹ email thông báo từ HR, và hướng dẫn đổi pass tại https://ess.fpt.com/. Bạn có thể tham khảo thêm tại: https://foxnews.fpt.vn/video-huong-dan-doi-mat-khau/"
"Từ ngày 4/5, tôi bắt buộc phải sử dụng email mới?","Vui lòng đọc kỹ email thông báo từ HR, và hướng dẫn đổi pass tại https://ess.fpt.com/. Bạn có thể tham khảo thêm tại: https://foxnews.fpt.vn/video-huong-dan-doi-mat-khau/"
"Trong lúc chờ pass email mới, tôi có dùng được email cũ không?","Vui lòng đọc kỹ email thông báo từ HR, và hướng dẫn đổi pass tại https://ess.fpt.com/. Bạn có thể tham khảo thêm tại: https://foxnews.fpt.vn/video-huong-dan-doi-mat-khau/Pasword của account mới sẽ được gửi đến người dùng trước ngày 08/05/2023. Password sẽ được BDA gửi tự động từ hệ thống Akabot-SSC (từ địa chỉ email fim.bot@fpt.com.vn). Do hệ thống gửi chậm nên bạn vui lòng chờ đợi thêm."
Pass mới mail @fpt.com nhận ở đâu?,Pasword của account mới sẽ được gửi đến người dùng trước ngày 08/05/2023. Password sẽ được BDA gửi tự động từ hệ thống Akabot-SSC (từ địa chỉ email fim.bot@fpt.com.vn). Do hệ thống gửi chậm nên bạn vui lòng chờ đợi thêm.
Mình hỏi lấy mật khẩu mail mới ở đâu?,Pasword của account mới sẽ được gửi đến người dùng trước ngày 08/05/2023. Password sẽ được BDA gửi tự động từ hệ thống Akabot-SSC (từ địa chỉ email fim.bot@fpt.com.vn). Do hệ thống gửi chậm nên bạn vui lòng chờ đợi thêm.
không thể đổi được mật khẩu?,"Vui lòng đọc kỹ email thông báo từ HR, và hướng dẫn đổi pass tại https://ess.fpt.com/. Bạn có thể tham khảo thêm tại: https://foxnews.fpt.vn/video-huong-dan-doi-mat-khau/"
mật khẩu mới sẽ được công ty cấp hay tự đổi?,Pasword của account mới sẽ được gửi đến người dùng trước ngày 08/05/2023. Password sẽ được BDA gửi tự động từ hệ thống Akabot-SSC (từ địa chỉ email fim.bot@fpt.com.vn). Do hệ thống gửi chậm nên bạn vui lòng chờ đợi thêm.
mail mới ngày nào?,Pasword của account mới sẽ được gửi đến người dùng trước ngày 08/05/2023. Password sẽ được BDA gửi tự động từ hệ thống Akabot-SSC (từ địa chỉ email fim.bot@fpt.com.vn). Do hệ thống gửi chậm nên bạn vui lòng chờ đợi thêm.
mail mới password ngày nào?,Pasword của account mới sẽ được gửi đến người dùng trước ngày 08/05/2023. Password sẽ được BDA gửi tự động từ hệ thống Akabot-SSC (từ địa chỉ email fim.bot@fpt.com.vn). Do hệ thống gửi chậm nên bạn vui lòng chờ đợi thêm.
password của mail mới?,Pasword của account mới sẽ được gửi đến người dùng trước ngày 08/05/2023. Password sẽ được BDA gửi tự động từ hệ thống Akabot-SSC (từ địa chỉ email fim.bot@fpt.com.vn). Do hệ thống gửi chậm nên bạn vui lòng chờ đợi thêm.
xin hướng dẫn để xem Pass đăng nhập email mới?,Pasword của account mới sẽ được gửi đến người dùng trước ngày 08/05/2023. Password sẽ được BDA gửi tự động từ hệ thống Akabot-SSC (từ địa chỉ email fim.bot@fpt.com.vn). Do hệ thống gửi chậm nên bạn vui lòng chờ đợi thêm.
Pass đăng nhập email sẽ được BDA gửi tự động từ hệ thống Akabot-SSC fim.bot@fpt.com.vn?,Pasword của account mới sẽ được gửi đến người dùng trước ngày 08/05/2023. Password sẽ được BDA gửi tự động từ hệ thống Akabot-SSC (từ địa chỉ email fim.bot@fpt.com.vn). Do hệ thống gửi chậm nên bạn vui lòng chờ đợi thêm.
Vậy là mình vẫn chưa có đúng ko bạn ơi,Pasword của account mới sẽ được gửi đến người dùng trước ngày 08/05/2023. Password sẽ được BDA gửi tự động từ hệ thống Akabot-SSC (từ địa chỉ email fim.bot@fpt.com.vn). Do hệ thống gửi chậm nên bạn vui lòng chờ đợi thêm.
doi pass mail?,"Vui lòng đọc kỹ email thông báo từ HR, và hướng dẫn đổi pass tại https://ess.fpt.com/. Bạn có thể tham khảo thêm tại: https://foxnews.fpt.vn/video-huong-dan-doi-mat-khau/"
Hướng dẫn đổi mật khẩu?,"Vui lòng đọc kỹ email thông báo từ HR, và hướng dẫn đổi pass tại https://ess.fpt.com/. Bạn có thể tham khảo thêm tại: https://foxnews.fpt.vn/video-huong-dan-doi-mat-khau/"
xác thực 2 bước?,Vui lòng xem hướng dẫn bật xác thực 2 bước tại đây: https://foxnews.fpt.vn/huong-dan-su-dung-xac-thuc-2-buoc-cho-tai-khoan-fpt-com/
tôi quên mật khẩu mail thì phải làm sao?,Vui lòng liên hệ admin/HCNS của đơn vị mở ticket reset mật khẩu trên uService
tôi chưa nhận được password cho mail mới?,Pasword của account mới sẽ được gửi đến người dùng trước ngày 08/05/2023. Password sẽ được BDA gửi tự động từ hệ thống Akabot-SSC (từ địa chỉ email fim.bot@fpt.com.vn). Do hệ thống gửi chậm nên bạn vui lòng chờ đợi thêm.
đăng nhập thì phải có mật khẩu trong khi mình chưa có mật khẩu?,Pasword của account mới sẽ được gửi đến người dùng trước ngày 08/05/2023. Password sẽ được BDA gửi tự động từ hệ thống Akabot-SSC (từ địa chỉ email fim.bot@fpt.com.vn). Do hệ thống gửi chậm nên bạn vui lòng chờ đợi thêm.
Tôi không thể thay đổi mật khẩu,"Vui lòng đọc kỹ email thông báo từ HR, và hướng dẫn đổi pass tại https://ess.fpt.com/. Bạn có thể tham khảo thêm tại: https://foxnews.fpt.vn/video-huong-dan-doi-mat-khau/"
đồng bộ mail,"Các email của năm 2023 sẽ được hệ thống tự động chuyển trước để người dùng thuận tiện làm việc. Các email của những năm trước sẽ được chuyển dần trong 2 tháng tiếp theo. Trong thời gian chuyển đổi, người dùng có thể login vào account cũ để xem lại các email chưa được chuyển và gửi email từ địa chỉ cũ nếu cần. Phần Calendar và Rules filter email người dùng phải chủ động tạo lại từ đầu."
chuyển đổi Onedrive?,Dữ liệu trên OneDrive cá nhân sẽ do người dùng chủ động thực hiện chuyển đổi. Hiện tại chưa có tool migrate việc phân quyền này nên người dùng tự đối chiếu phân quyền cũ và cấu hình phân quyền truy nhập File/folder cho OneDrive/ Google Drive mới. Tham khảo hướng dẫn chuyển dữ liệu OneDrive sang account mới tại https://foxnews.fpt.vn/huong-dan-chuyen-doi-du-lieu-onedrive-tu-fpt-com-vn-sang-fpt-com/
không thấy Pass của mail mới gửi từ Akabot vậy nhỉ,Pasword của account mới sẽ được gửi đến người dùng trước ngày 08/05/2023. Password sẽ được BDA gửi tự động từ hệ thống Akabot-SSC (từ địa chỉ email fim.bot@fpt.com.vn). Do hệ thống gửi chậm nên bạn vui lòng chờ đợi thêm.
"Hiện mình chưa nhận được mật khẩu vào account fpt.com của Akabot-SSC, mật khẩu này sẽ được cung
cấp sau mail thông báo đúng không?",Pasword của account mới sẽ được gửi đến người dùng trước ngày 08/05/2023. Password sẽ được BDA gửi tự động từ hệ thống Akabot-SSC (từ địa chỉ email fim.bot@fpt.com.vn). Do hệ thống gửi chậm nên bạn vui lòng chờ đợi thêm.
làm sao để liện hệ Akabot?,Akabot sẽ chủ động liên hệ với bạn.
Số điện thoại hỗ trợ là số nào vậy ?,Mọi thắc mắc trong quá trình chuyển đổi vui lòng đặt câu hỏi với chat bot “FTEL IT Support” trên Workplace.
Chưa nhận pass?,Pasword của account mới sẽ được gửi đến người dùng trước ngày 08/05/2023. Password sẽ được BDA gửi tự động từ hệ thống Akabot-SSC (từ địa chỉ email fim.bot@fpt.com.vn). Do hệ thống gửi chậm nên bạn vui lòng chờ đợi thêm.
Mật khẩu email khi nào có vậy pa,Pasword của account mới sẽ được gửi đến người dùng trước ngày 08/05/2023. Password sẽ được BDA gửi tự động từ hệ thống Akabot-SSC (từ địa chỉ email fim.bot@fpt.com.vn). Do hệ thống gửi chậm nên bạn vui lòng chờ đợi thêm.
"sao mình đặt mật khẩu không được, đã đặt theo hướng dẫn ạ","Vui lòng đọc kỹ email thông báo từ HR, và hướng dẫn đổi pass tại https://ess.fpt.com/. Bạn có thể tham khảo thêm tại: https://foxnews.fpt.vn/video-huong-dan-doi-mat-khau/"
chuyển đổi đuôi mail mới thì dùng password nào,Pasword của account mới sẽ được gửi đến người dùng trước ngày 08/05/2023. Password sẽ được BDA gửi tự động từ hệ thống Akabot-SSC (từ địa chỉ email fim.bot@fpt.com.vn). Do hệ thống gửi chậm nên bạn vui lòng chờ đợi thêm.
"Dear FTEL IT, mih đã nhận được mail ""Acc mail FPT.COM: Hướng dẫn đổi mật khẩu, xác thực 2 bước""?","Vui lòng đọc kỹ email thông báo từ HR, và hướng dẫn đổi pass tại https://ess.fpt.com/. Bạn có thể tham khảo thêm tại: https://foxnews.fpt.vn/video-huong-dan-doi-mat-khau/"
không truy cập đc?,Bạn vui lòng đặt các câu hỏi đầy đủ và cụ thể hơn!
link mật khẩu mới?,Pasword của account mới sẽ được gửi đến người dùng trước ngày 08/05/2023. Password sẽ được BDA gửi tự động từ hệ thống Akabot-SSC (từ địa chỉ email fim.bot@fpt.com.vn). Do hệ thống gửi chậm nên bạn vui lòng chờ đợi thêm.
"Tôi có thông báo sử dụng account email mới nhưng chưa thấy hệ thống gửi mật khẩu của account để
vào đổi mật khẩu như hướng dẫn!?",Pasword của account mới sẽ được gửi đến người dùng trước ngày 08/05/2023. Password sẽ được BDA gửi tự động từ hệ thống Akabot-SSC (từ địa chỉ email fim.bot@fpt.com.vn). Do hệ thống gửi chậm nên bạn vui lòng chờ đợi thêm.
khi nào password mới của mail đuôi .com mới gửi tới mail,Pasword của account mới sẽ được gửi đến người dùng trước ngày 08/05/2023. Password sẽ được BDA gửi tự động từ hệ thống Akabot-SSC (từ địa chỉ email fim.bot@fpt.com.vn). Do hệ thống gửi chậm nên bạn vui lòng chờ đợi thêm.
link akabot scc,Bạn vui lòng đặt các câu hỏi đầy đủ và cụ thể hơn!
Không có mật khẩu cũ nên không đổi được mật khẩu mới?,Pasword của account mới sẽ được gửi đến người dùng trước ngày 08/05/2023. Password sẽ được BDA gửi tự động từ hệ thống Akabot-SSC (từ địa chỉ email fim.bot@fpt.com.vn). Do hệ thống gửi chậm nên bạn vui lòng chờ đợi thêm.
Pass đăng nhập email sẽ được BDA gửi tự động từ hệ thống Akabot-SSC fim.bot@fpt.com.vn,Pasword của account mới sẽ được gửi đến người dùng trước ngày 08/05/2023. Password sẽ được BDA gửi tự động từ hệ thống Akabot-SSC (từ địa chỉ email fim.bot@fpt.com.vn). Do hệ thống gửi chậm nên bạn vui lòng chờ đợi thêm.
lấy như thế nào?,Bạn vui lòng đặt các câu hỏi đầy đủ và cụ thể hơn!
mail mới của tôi là gì?,"Account mới sẽ được gửi đến người dùng bắt đầu từ ngày 08/05/2023. Nếu có nhu cầu đặc biệt cần cấp sớm hơn, có thể tạo
ticket trên ssc.fpt.net với nhân sự để được active sớm"
chưa nhận được password cho mail mới uyentnp7@fpt.com,Pasword của account mới sẽ được gửi đến người dùng trước ngày 08/05/2023. Password sẽ được BDA gửi tự động từ hệ thống Akabot-SSC (từ địa chỉ email fim.bot@fpt.com.vn). Do hệ thống gửi chậm nên bạn vui lòng chờ đợi thêm.
em nhập cả pass cũ và pass mới đều k được,Có thể bạn nhầm email cũ (fpt.com.vn). Bước đổi mật khẩu là đổi mật khẩu của email mới (fpt.com)Pasword của account mới sẽ được gửi đến người dùng trước ngày 08/05/2023. Password sẽ được BDA gửi tự động từ hệ thống Akabot-SSC (từ địa chỉ email fim.bot@fpt.com.vn). Do hệ thống gửi chậm nên bạn vui lòng chờ đợi thêm.
my email password?,Pasword của account mới sẽ được gửi đến người dùng trước ngày 08/05/2023. Password sẽ được BDA gửi tự động từ hệ thống Akabot-SSC (từ địa chỉ email fim.bot@fpt.com.vn). Do hệ thống gửi chậm nên bạn vui lòng chờ đợi thêm.
pass cu mail cua t o dau,Pasword của account mới sẽ được gửi đến người dùng trước ngày 08/05/2023. Password sẽ được BDA gửi tự động từ hệ thống Akabot-SSC (từ địa chỉ email fim.bot@fpt.com.vn). Do hệ thống gửi chậm nên bạn vui lòng chờ đợi thêm.
"Cho em hỏi, hiện tại đã sử dụng đc mail đuôi fpt.com chưa vậy, vì em chưa nhận được pass từ Akabot-SSC fim.bot@fpt.com.vn.
Em đang cần đăng nhập vào các trang https://daotao.fpt.com.vn, booking.fpt.com.vn nhưng k vào được do thay đổi mail.
Nhờ admin giúp đỡ ạ.",Pasword của account mới sẽ được gửi đến người dùng trước ngày 08/05/2023. Password sẽ được BDA gửi tự động từ hệ thống Akabot-SSC (từ địa chỉ email fim.bot@fpt.com.vn). Do hệ thống gửi chậm nên bạn vui lòng chờ đợi thêm.
"Mình đã vào được trang đổi pass, tuy nhiên vẫn báo lỗi đổi pass k thành công.",Có thể bạn nhầm email cũ (fpt.com.vn). Bước đổi mật khẩu là đổi mật khẩu của email mới (fpt.com)Pasword của account mới sẽ được gửi đến người dùng trước ngày 08/05/2023. Password sẽ được BDA gửi tự động từ hệ thống Akabot-SSC (từ địa chỉ email fim.bot@fpt.com.vn). Do hệ thống gửi chậm nên bạn vui lòng chờ đợi thêm.
em nhận được thông báo này nhưng em chưa nhận được pass đăng nhập mail mới ạ,Pasword của account mới sẽ được gửi đến người dùng trước ngày 08/05/2023. Password sẽ được BDA gửi tự động từ hệ thống Akabot-SSC (từ địa chỉ email fim.bot@fpt.com.vn). Do hệ thống gửi chậm nên bạn vui lòng chờ đợi thêm.
pass account mail mới @fpt.com là gi?,Pasword của account mới sẽ được gửi đến người dùng trước ngày 08/05/2023. Password sẽ được BDA gửi tự động từ hệ thống Akabot-SSC (từ địa chỉ email fim.bot@fpt.com.vn). Do hệ thống gửi chậm nên bạn vui lòng chờ đợi thêm.
Akabot-SSC?,Bạn vui lòng đặt các câu hỏi đầy đủ và cụ thể hơn!
password mail?,Pasword của account mới sẽ được gửi đến người dùng trước ngày 08/05/2023. Password sẽ được BDA gửi tự động từ hệ thống Akabot-SSC (từ địa chỉ email fim.bot@fpt.com.vn). Do hệ thống gửi chậm nên bạn vui lòng chờ đợi thêm.
mật khẩu mail binhpd2@fpt.com là gì?,Pasword của account mới sẽ được gửi đến người dùng trước ngày 08/05/2023. Password sẽ được BDA gửi tự động từ hệ thống Akabot-SSC (từ địa chỉ email fim.bot@fpt.com.vn). Do hệ thống gửi chậm nên bạn vui lòng chờ đợi thêm.
sao bot không biết?,Bạn vui lòng đặt các câu hỏi đầy đủ và cụ thể hơn!
thế ai hỗ trợ tôi?,Bạn vui lòng đặt các câu hỏi đầy đủ và cụ thể hơn!
muốn chuyển sharepoint từ FPT.com.vn sang FPT.com làm thế nào?,"Các site Sharepoint sẽ không được chuyển đổi dữ liệu tự động. Admin của site cần chủ động thực hiện backup/restore dữ liệu sang site Sharepoint mới. Hướng dẫn chi tiết chuyển đổi Sharepoint, vui lòng xem ở đây: https://foxnews.fpt.vn/huong-dan-sao-luu-va-dong-bo-du-lieu-cong-cu-sharepoint/ Trong thời gian chưa chuyển đổi, người dùng tiếp tục dùng tài khoản cũ (@fpt.com.vn) để truy cập vào Sharepoint. Admin của các site Sharepoint có dữ liệu lớn cần hỗ trợ chuyển đổi có thể liên hệ bộ phận IT để được giúp đỡ."
mật khẩu của mail @fpt.com là gì?,Pasword của account mới sẽ được gửi đến người dùng trước ngày 08/05/2023. Password sẽ được BDA gửi tự động từ hệ thống Akabot-SSC (từ địa chỉ email fim.bot@fpt.com.vn). Do hệ thống gửi chậm nên bạn vui lòng chờ đợi thêm.
Khi nào có pass mail?,Pasword của account mới sẽ được gửi đến người dùng trước ngày 08/05/2023. Password sẽ được BDA gửi tự động từ hệ thống Akabot-SSC (từ địa chỉ email fim.bot@fpt.com.vn). Do hệ thống gửi chậm nên bạn vui lòng chờ đợi thêm.
Pass đăng nhập email?,Pasword của account mới sẽ được gửi đến người dùng trước ngày 08/05/2023. Password sẽ được BDA gửi tự động từ hệ thống Akabot-SSC (từ địa chỉ email fim.bot@fpt.com.vn). Do hệ thống gửi chậm nên bạn vui lòng chờ đợi thêm.
đổi bằng pass mail cũ đúng không?,Không! Pasword của account mới sẽ được gửi đến người dùng trước ngày 08/05/2023. Password sẽ được BDA gửi tự động từ hệ thống Akabot-SSC (từ địa chỉ email fim.bot@fpt.com.vn). Do hệ thống gửi chậm nên bạn vui lòng chờ đợi thêm.
pass lấy ở đâu?,Pasword của account mới sẽ được gửi đến người dùng trước ngày 08/05/2023. Password sẽ được BDA gửi tự động từ hệ thống Akabot-SSC (từ địa chỉ email fim.bot@fpt.com.vn). Do hệ thống gửi chậm nên bạn vui lòng chờ đợi thêm.
mình đổi pass theo mail này?,Pasword của account mới sẽ được gửi đến người dùng trước ngày 08/05/2023. Password sẽ được BDA gửi tự động từ hệ thống Akabot-SSC (từ địa chỉ email fim.bot@fpt.com.vn). Do hệ thống gửi chậm nên bạn vui lòng chờ đợi thêm.
clip hướng dẫn k có?,Vui lòng tham khảo các hướng dẫn chuyển đổi tại: https://foxnews.fpt.vn/category/fcc/chuyendoifpt-com/
Làm thế nào để có email mới?,Pasword của account mới sẽ được gửi đến người dùng trước ngày 08/05/2023. Password sẽ được BDA gửi tự động từ hệ thống Akabot-SSC (từ địa chỉ email fim.bot@fpt.com.vn). Do hệ thống gửi chậm nên bạn vui lòng chờ đợi thêm.
Gặp ai để đăng ký?,Pasword của account mới sẽ được gửi đến người dùng trước ngày 08/05/2023. Password sẽ được BDA gửi tự động từ hệ thống Akabot-SSC (từ địa chỉ email fim.bot@fpt.com.vn). Do hệ thống gửi chậm nên bạn vui lòng chờ đợi thêm.
cho mình hỏi pass để đổi mật khẩu fpt.com thì hệ thống tự gửi về đâu ah?,Pasword của account mới sẽ được gửi đến người dùng trước ngày 08/05/2023. Password sẽ được BDA gửi tự động từ hệ thống Akabot-SSC (từ địa chỉ email fim.bot@fpt.com.vn). Do hệ thống gửi chậm nên bạn vui lòng chờ đợi thêm.
tôi cần được cấp lại mật khẩu email?,Pasword của account mới sẽ được gửi đến người dùng trước ngày 08/05/2023. Password sẽ được BDA gửi tự động từ hệ thống Akabot-SSC (từ địa chỉ email fim.bot@fpt.com.vn). Do hệ thống gửi chậm nên bạn vui lòng chờ đợi thêm.
mình thấy pass đăng nhập email sẽ được BDA gửi tự động từ hệ thống akabot-ssc fim.bot@fpt.com.vn?,Pasword của account mới sẽ được gửi đến người dùng trước ngày 08/05/2023. Password sẽ được BDA gửi tự động từ hệ thống Akabot-SSC (từ địa chỉ email fim.bot@fpt.com.vn). Do hệ thống gửi chậm nên bạn vui lòng chờ đợi thêm.
