hello,Xin chàoo
mình đang hỏi pass này,Pasword của account mới sẽ được gửi đến người dùng trước ngày 08/05/2023. Password sẽ được BDA gửi tự động từ hệ thống Akabot-SSC (từ địa chỉ email fim.bot@fpt.com.vn). Do hệ thống gửi chậm nên bạn vui lòng chờ đợi thêm.
"tôi vẫn chưa nhận được Anh sẽ sử dụng account VANGVC@FPT.COM

Pass đăng nhập email sẽ được BDA gửi tự động từ hệ thống Akabot-SSC fim.bot@fpt.com.vn",Pasword của account mới sẽ được gửi đến người dùng trước ngày 08/05/2023. Password sẽ được BDA gửi tự động từ hệ thống Akabot-SSC (từ địa chỉ email fim.bot@fpt.com.vn). Do hệ thống gửi chậm nên bạn vui lòng chờ đợi thêm.
pass đăng nhập,Pasword của account mới sẽ được gửi đến người dùng trước ngày 08/05/2023. Password sẽ được BDA gửi tự động từ hệ thống Akabot-SSC (từ địa chỉ email fim.bot@fpt.com.vn). Do hệ thống gửi chậm nên bạn vui lòng chờ đợi thêm.
send me the password,Pasword của account mới sẽ được gửi đến người dùng trước ngày 08/05/2023. Password sẽ được BDA gửi tự động từ hệ thống Akabot-SSC (từ địa chỉ email fim.bot@fpt.com.vn). Do hệ thống gửi chậm nên bạn vui lòng chờ đợi thêm.
Chưa thấy gửi pass mail để chuyển đổi tên miền?,Pasword của account mới sẽ được gửi đến người dùng trước ngày 08/05/2023. Password sẽ được BDA gửi tự động từ hệ thống Akabot-SSC (từ địa chỉ email fim.bot@fpt.com.vn). Do hệ thống gửi chậm nên bạn vui lòng chờ đợi thêm.
Akabot-SSC chưa cấp mật khẩu mới vào tài khoản quanbx@fpt.com.vn cho em ạ?,Pasword của account mới sẽ được gửi đến người dùng trước ngày 08/05/2023. Password sẽ được BDA gửi tự động từ hệ thống Akabot-SSC (từ địa chỉ email fim.bot@fpt.com.vn). Do hệ thống gửi chậm nên bạn vui lòng chờ đợi thêm.
Pass đăng nhập email sẽ được BDA gửi tự động từ hệ thống Akabot-SSC fim.bot@fpt.com.vn?,Pasword của account mới sẽ được gửi đến người dùng trước ngày 08/05/2023. Password sẽ được BDA gửi tự động từ hệ thống Akabot-SSC (từ địa chỉ email fim.bot@fpt.com.vn). Do hệ thống gửi chậm nên bạn vui lòng chờ đợi thêm.
Akabot-SSC password?,Pasword của account mới sẽ được gửi đến người dùng trước ngày 08/05/2023. Password sẽ được BDA gửi tự động từ hệ thống Akabot-SSC (từ địa chỉ email fim.bot@fpt.com.vn). Do hệ thống gửi chậm nên bạn vui lòng chờ đợi thêm.
lấy pass đăng nhập của account?,Pasword của account mới sẽ được gửi đến người dùng trước ngày 08/05/2023. Password sẽ được BDA gửi tự động từ hệ thống Akabot-SSC (từ địa chỉ email fim.bot@fpt.com.vn). Do hệ thống gửi chậm nên bạn vui lòng chờ đợi thêm.
"Xin chào, tôi không đặt được mật khẩu cho account mới?",Pasword của account mới sẽ được gửi đến người dùng trước ngày 08/05/2023. Password sẽ được BDA gửi tự động từ hệ thống Akabot-SSC (từ địa chỉ email fim.bot@fpt.com.vn). Do hệ thống gửi chậm nên bạn vui lòng chờ đợi thêm.
phải có mật khẩu này mới làm các bước kia được pk ạ?,Pasword của account mới sẽ được gửi đến người dùng trước ngày 08/05/2023. Password sẽ được BDA gửi tự động từ hệ thống Akabot-SSC (từ địa chỉ email fim.bot@fpt.com.vn). Do hệ thống gửi chậm nên bạn vui lòng chờ đợi thêm.
mật khẩu email fpt.com?,Pasword của account mới sẽ được gửi đến người dùng trước ngày 08/05/2023. Password sẽ được BDA gửi tự động từ hệ thống Akabot-SSC (từ địa chỉ email fim.bot@fpt.com.vn). Do hệ thống gửi chậm nên bạn vui lòng chờ đợi thêm.
chưa nhận được email pass tannt9?,Pasword của account mới sẽ được gửi đến người dùng trước ngày 08/05/2023. Password sẽ được BDA gửi tự động từ hệ thống Akabot-SSC (từ địa chỉ email fim.bot@fpt.com.vn). Do hệ thống gửi chậm nên bạn vui lòng chờ đợi thêm.
password email?,Pasword của account mới sẽ được gửi đến người dùng trước ngày 08/05/2023. Password sẽ được BDA gửi tự động từ hệ thống Akabot-SSC (từ địa chỉ email fim.bot@fpt.com.vn). Do hệ thống gửi chậm nên bạn vui lòng chờ đợi thêm.
xem password của email mới lấy ở đâu?,Pasword của account mới sẽ được gửi đến người dùng trước ngày 08/05/2023. Password sẽ được BDA gửi tự động từ hệ thống Akabot-SSC (từ địa chỉ email fim.bot@fpt.com.vn). Do hệ thống gửi chậm nên bạn vui lòng chờ đợi thêm.
"Hệ thống báo sai tk hoặc pass
K tiến hành đổi được mk",Pasword của account mới sẽ được gửi đến người dùng trước ngày 08/05/2023. Password sẽ được BDA gửi tự động từ hệ thống Akabot-SSC (từ địa chỉ email fim.bot@fpt.com.vn). Do hệ thống gửi chậm nên bạn vui lòng chờ đợi thêm.
mật khẩu mới lấy bằng cách nào vậy ạ,Pasword của account mới sẽ được gửi đến người dùng trước ngày 08/05/2023. Password sẽ được BDA gửi tự động từ hệ thống Akabot-SSC (từ địa chỉ email fim.bot@fpt.com.vn). Do hệ thống gửi chậm nên bạn vui lòng chờ đợi thêm.
lấy ở đâu ạ,Pasword của account mới sẽ được gửi đến người dùng trước ngày 08/05/2023. Password sẽ được BDA gửi tự động từ hệ thống Akabot-SSC (từ địa chỉ email fim.bot@fpt.com.vn). Do hệ thống gửi chậm nên bạn vui lòng chờ đợi thêm.
anh chị cho e hỏi mk đc gửi tự động từ hệ thống Akabot-SSC fim.bot@fpt.com.vn,Pasword của account mới sẽ được gửi đến người dùng trước ngày 08/05/2023. Password sẽ được BDA gửi tự động từ hệ thống Akabot-SSC (từ địa chỉ email fim.bot@fpt.com.vn). Do hệ thống gửi chậm nên bạn vui lòng chờ đợi thêm.
Chỗ đổi pass thì pass cũ là mình lấy ở đâu ạ?,Pasword của account mới sẽ được gửi đến người dùng trước ngày 08/05/2023. Password sẽ được BDA gửi tự động từ hệ thống Akabot-SSC (từ địa chỉ email fim.bot@fpt.com.vn). Do hệ thống gửi chậm nên bạn vui lòng chờ đợi thêm.
đổi pass cho đuôi .com ạ?,Pasword của account mới sẽ được gửi đến người dùng trước ngày 08/05/2023. Password sẽ được BDA gửi tự động từ hệ thống Akabot-SSC (từ địa chỉ email fim.bot@fpt.com.vn). Do hệ thống gửi chậm nên bạn vui lòng chờ đợi thêm.
"Theo kế hoạch điều chỉnh và thông báo FHR đã gửi, kể từ ngày 04.05.202, Chị sẽ sử dụng account THAONTH7@FPT.COM

Pass đăng nhập email sẽ được BDA gửi tự động từ hệ thống Akabot-SSC fim.bot@fpt.com.vn?",Pasword của account mới sẽ được gửi đến người dùng trước ngày 08/05/2023. Password sẽ được BDA gửi tự động từ hệ thống Akabot-SSC (từ địa chỉ email fim.bot@fpt.com.vn). Do hệ thống gửi chậm nên bạn vui lòng chờ đợi thêm.
Anh/chị cho hỏi em chưa thấy mật khẩu akabot gửi về,Pasword của account mới sẽ được gửi đến người dùng trước ngày 08/05/2023. Password sẽ được BDA gửi tự động từ hệ thống Akabot-SSC (từ địa chỉ email fim.bot@fpt.com.vn). Do hệ thống gửi chậm nên bạn vui lòng chờ đợi thêm.
Pass đăng nhập email longpdk@fpt.com?,Pasword của account mới sẽ được gửi đến người dùng trước ngày 08/05/2023. Password sẽ được BDA gửi tự động từ hệ thống Akabot-SSC (từ địa chỉ email fim.bot@fpt.com.vn). Do hệ thống gửi chậm nên bạn vui lòng chờ đợi thêm.
khi nào mới nhận được pass email mới?,Pasword của account mới sẽ được gửi đến người dùng trước ngày 08/05/2023. Password sẽ được BDA gửi tự động từ hệ thống Akabot-SSC (từ địa chỉ email fim.bot@fpt.com.vn). Do hệ thống gửi chậm nên bạn vui lòng chờ đợi thêm.
cho mình hỏi đổi mk sao cứ báo email sai,Có thể bạn nhầm email cũ (fpt.com.vn). Bước đổi mật khẩu là đổi mật khẩu của email mới (fpt.com)Pasword của account mới sẽ được gửi đến người dùng trước ngày 08/05/2023. Password sẽ được BDA gửi tự động từ hệ thống Akabot-SSC (từ địa chỉ email fim.bot@fpt.com.vn). Do hệ thống gửi chậm nên bạn vui lòng chờ đợi thêm.
mình có mật khẩu mail cũ đúng nhưng ko login dc,Mật khẩu cũ (fpt.com.vn) không dùng được cho account mới. Pasword của account mới sẽ được gửi đến người dùng trước ngày 08/05/2023. Password sẽ được BDA gửi tự động từ hệ thống Akabot-SSC (từ địa chỉ email fim.bot@fpt.com.vn). Do hệ thống gửi chậm nên bạn vui lòng chờ đợi thêm.
khi nào mình mới được cấp mật khẩu để đổi sang tài khoản fpt.com,Pasword của account mới sẽ được gửi đến người dùng trước ngày 08/05/2023. Password sẽ được BDA gửi tự động từ hệ thống Akabot-SSC (từ địa chỉ email fim.bot@fpt.com.vn). Do hệ thống gửi chậm nên bạn vui lòng chờ đợi thêm.
account mới mật khẩu là dùng mk cũ luôn à,Pasword của account mới sẽ được gửi đến người dùng trước ngày 08/05/2023. Password sẽ được BDA gửi tự động từ hệ thống Akabot-SSC (từ địa chỉ email fim.bot@fpt.com.vn). Do hệ thống gửi chậm nên bạn vui lòng chờ đợi thêm.
rồi đăng nhập dc rồi,Mật khẩu cũ (fpt.com.vn) không dùng được cho account mới. Pasword của account mới sẽ được gửi đến người dùng trước ngày 08/05/2023. Password sẽ được BDA gửi tự động từ hệ thống Akabot-SSC (từ địa chỉ email fim.bot@fpt.com.vn). Do hệ thống gửi chậm nên bạn vui lòng chờ đợi thêm.
tại sao tôi vẫn chưa nhận được email pass fpt.com?,Pasword của account mới sẽ được gửi đến người dùng trước ngày 08/05/2023. Password sẽ được BDA gửi tự động từ hệ thống Akabot-SSC (từ địa chỉ email fim.bot@fpt.com.vn). Do hệ thống gửi chậm nên bạn vui lòng chờ đợi thêm.
Sao em k đổi dc mk nhỉ?nhập mk cũ chính xác rồi mà?,Có thể bạn nhầm email cũ (fpt.com.vn). Bước đổi mật khẩu là đổi mật khẩu của email mới (fpt.com)Pasword của account mới sẽ được gửi đến người dùng trước ngày 08/05/2023. Password sẽ được BDA gửi tự động từ hệ thống Akabot-SSC (từ địa chỉ email fim.bot@fpt.com.vn). Do hệ thống gửi chậm nên bạn vui lòng chờ đợi thêm.
Tôi cần lấy lại mật khẩu mail thonglm8@fpt.com,Vui lòng liên hệ admin/HCNS của đơn vị mở ticket reset mật khẩu trên uService
Hỗ trợ đổi pass mail mới ạ?,"Vui lòng đọc kỹ email thông báo từ HR, và hướng dẫn đổi pass tại https://ess.fpt.com/. Bạn có thể tham khảo thêm tại: https://foxnews.fpt.vn/video-huong-dan-doi-mat-khau/"
tôi chưa thấy gửi mật khẩu email của hungtm28@fpt.com?,Pasword của account mới sẽ được gửi đến người dùng trước ngày 08/05/2023. Password sẽ được BDA gửi tự động từ hệ thống Akabot-SSC (từ địa chỉ email fim.bot@fpt.com.vn). Do hệ thống gửi chậm nên bạn vui lòng chờ đợi thêm.
Pass đăng nhập email THAOLT50@FPT.COM?,Pasword của account mới sẽ được gửi đến người dùng trước ngày 08/05/2023. Password sẽ được BDA gửi tự động từ hệ thống Akabot-SSC (từ địa chỉ email fim.bot@fpt.com.vn). Do hệ thống gửi chậm nên bạn vui lòng chờ đợi thêm.
"workchat chỉ vào đc bằng tab ẩn danh, vào tab chính thì ko cho đăng nhập?"," Truy cập link sau (lưu ý: trên iPhone phải dùng Safari, trên Android dùng trình duyệt mặc định) để sign-out khỏi account cũ (fpt.com.vn) và đăng nhập lại bằng account mới
https://login.microsoftonline.com/logout.srf"
"Ad cho em hỏi với ạ, em mới nhận mail đổi mk, nhưng không có mật khẩu cũ sao đổi được ạ?",Pasword của account mới sẽ được gửi đến người dùng trước ngày 08/05/2023. Password sẽ được BDA gửi tự động từ hệ thống Akabot-SSC (từ địa chỉ email fim.bot@fpt.com.vn). Do hệ thống gửi chậm nên bạn vui lòng chờ đợi thêm.
Workplace chỉ vào được bằng tab ẩn danh thì phải làm gì?," Truy cập link sau (lưu ý: trên iPhone phải dùng Safari, trên Android dùng trình duyệt mặc định) để sign-out khỏi account cũ (fpt.com.vn) và đăng nhập lại bằng account mới
https://login.microsoftonline.com/logout.srf"
"hi, mình không nhận được email từ Akabot-SSC fim.bot@fpt.com.vn cung cấp password cho tk
vuda7@fpt.com?",Pasword của account mới sẽ được gửi đến người dùng trước ngày 08/05/2023. Password sẽ được BDA gửi tự động từ hệ thống Akabot-SSC (từ địa chỉ email fim.bot@fpt.com.vn). Do hệ thống gửi chậm nên bạn vui lòng chờ đợi thêm.
Mình chưa nhận được mật khẩu mới từ Akabot-SSC?,Pasword của account mới sẽ được gửi đến người dùng trước ngày 08/05/2023. Password sẽ được BDA gửi tự động từ hệ thống Akabot-SSC (từ địa chỉ email fim.bot@fpt.com.vn). Do hệ thống gửi chậm nên bạn vui lòng chờ đợi thêm.
pass email mới gửi về chưa?,Pasword của account mới sẽ được gửi đến người dùng trước ngày 08/05/2023. Password sẽ được BDA gửi tự động từ hệ thống Akabot-SSC (từ địa chỉ email fim.bot@fpt.com.vn). Do hệ thống gửi chậm nên bạn vui lòng chờ đợi thêm.
mật khẩu mới của email .fpt.com thì akabot gửi qua đâu vậy bạn?,Pasword của account mới sẽ được gửi đến người dùng trước ngày 08/05/2023. Password sẽ được BDA gửi tự động từ hệ thống Akabot-SSC (từ địa chỉ email fim.bot@fpt.com.vn). Do hệ thống gửi chậm nên bạn vui lòng chờ đợi thêm.
vậy khi nào thì mật khẩu mới được gửi qua email hiện tại vậy bạn?,Pasword của account mới sẽ được gửi đến người dùng trước ngày 08/05/2023. Password sẽ được BDA gửi tự động từ hệ thống Akabot-SSC (từ địa chỉ email fim.bot@fpt.com.vn). Do hệ thống gửi chậm nên bạn vui lòng chờ đợi thêm.
pass mail?,Pasword của account mới sẽ được gửi đến người dùng trước ngày 08/05/2023. Password sẽ được BDA gửi tự động từ hệ thống Akabot-SSC (từ địa chỉ email fim.bot@fpt.com.vn). Do hệ thống gửi chậm nên bạn vui lòng chờ đợi thêm.
"workchat chỉ vào đc bằng tab ẩn danh, vào tab chính thì ko cho đăng nhập?"," Truy cập link sau (lưu ý: trên iPhone phải dùng Safari, trên Android dùng trình duyệt mặc định) để sign-out khỏi account cũ (fpt.com.vn) và đăng nhập lại bằng account mới
https://login.microsoftonline.com/logout.srf"
em chưa nhận được pass từ hệ thống gửi?,Pasword của account mới sẽ được gửi đến người dùng trước ngày 08/05/2023. Password sẽ được BDA gửi tự động từ hệ thống Akabot-SSC (từ địa chỉ email fim.bot@fpt.com.vn). Do hệ thống gửi chậm nên bạn vui lòng chờ đợi thêm.
"dạ em đăng nhập đổi mật xác thực 2 bước cứ báo nhập khẩu và acc ko đúng .Dù em đã đăng nhập đúng
mật khẩu b?",Có thể bạn nhầm email cũ (fpt.com.vn). Bước đổi mật khẩu là đổi mật khẩu của email mới (fpt.com)Pasword của account mới sẽ được gửi đến người dùng trước ngày 08/05/2023. Password sẽ được BDA gửi tự động từ hệ thống Akabot-SSC (từ địa chỉ email fim.bot@fpt.com.vn). Do hệ thống gửi chậm nên bạn vui lòng chờ đợi thêm.
Minh không đổi được password mới?,"Vui lòng đọc kỹ email thông báo từ HR, và hướng dẫn đổi pass tại https://ess.fpt.com/. Bạn có thể tham khảo thêm tại: https://foxnews.fpt.vn/video-huong-dan-doi-mat-khau/"
Tôi muốn thêm phương thức xác thực khác thì làm thế nào?,"Truy cập link: https://mysignins.microsoft.com/security-info
Tại Security info > Add sign-in method > Choose a method,  chọn App hoặc Số điện thoại (tuỳ theo nhu cầu, khuyến cáo dùng App) > chọn Add và làm theo hướng dẫn"
Tôi muốn thêm xác thực 2 bước bằng app?,"Truy cập link: https://mysignins.microsoft.com/security-info
Tại Security info > Add sign-in method > Choose a method,  chọn App hoặc Số điện thoại (tuỳ theo nhu cầu, khuyến cáo dùng App) > chọn Add và làm theo hướng dẫn"
Tôi muốn thêm xác thực 2 bước bằng số điện thoại?,"Truy cập link: https://mysignins.microsoft.com/security-info
Tại Security info > Add sign-in method > Choose a method,  chọn App hoặc Số điện thoại (tuỳ theo nhu cầu, khuyến cáo dùng App) > chọn Add và làm theo hướng dẫn"
sau này nhân viên ftel có dùng đc @fpt.com trên https://outlook.office.com/mail/ ko? hay chỉ có thể dùng trên gmail thôi?,"Không. Người dùng khối công nghệ hạ tầng và một số cán bộ của FTC, FCC, FTC sử dụng account trên nền tảng Google Workspace. Còn lại sử dụng trên Office 365."
"mình cố thử dùng outlook để lấy mail @fpt.com thì bị lỗi này, tương lai thì còn dùng đc trên outlook.com này ko?","Không. Người dùng khối công nghệ hạ tầng và một số cán bộ của FTC, FCC, FTC sử dụng account trên nền tảng Google Workspace. Còn lại sử dụng trên Office 365."
Lỗi xác thực authenticator (báo mã ko đúng)? Xác thực điện thoại không thấy trả code về?,"Vui lòng kiểm tra đúng user và password mới trước khi đăng nhập. Thoát ra ngoài (nút back hoặc đóng hẳn tab của trình duyệt) và thử lại. Lưu ý mã QR chỉ có hiệu lực trong 1 phút. Bạn phải dùng Microsoft Authenticator để quét QR:
https://www.microsoft.com/en-us/security/mobile-authenticator-app"
Lỗi đăng nhập mail box và lỗi không hiển thị app trong microsoft 365,Vui lòng thông báo với admin/HCNS để tổng hợp và gửi lên FIM kiểm tra lại
ko login đc vào workplace trên máy tính - workchat trên điện thoại vẫn dùng được," Truy cập link sau (lưu ý: trên iPhone phải dùng Safari, trên Android dùng trình duyệt mặc định) để sign-out khỏi account cũ (fpt.com.vn) và đăng nhập lại bằng account mới
https://login.microsoftonline.com/logout.srf"
"Lỗi không đăng nhập được workchat trên app điện thoại, đăng nhập được trên máy tính công ty",Pasword của account mới sẽ được gửi đến người dùng trước ngày 08/05/2023. Password sẽ được BDA gửi tự động từ hệ thống Akabot-SSC (từ địa chỉ email fim.bot@fpt.com.vn). Do hệ thống gửi chậm nên bạn vui lòng chờ đợi thêm.
