dữ liệu cũ trong outlook trong mail cũ fpt.com.vn có được backup và chuyển sang cho mail mới fpt.com hay không? vì đang dùng outlook bản web?,"Các email năm 2023 sẽ được chuyển trước để người dùng thuận tiện làm việc. Email trước đó sẽ được chuyển dần trong 2 tháng tiếp theo. Trong thời gian chuyển đổi, người dùng có thể login vào account cũ để xem lại các mail chưa được chuyển và gửi email từ địa chỉ cũ nếu cần. Phần calendar và rule mail người dùng chủ động tạo lại từ đầu."
"dạ cho em hỏi là mail của em hiện tại có đăng ký dùng wifi áp dụng ưu đãi cho nhân viên, vậy khi chuyển qua mail mới thì có bị gì không ạ.
Cty có hỗ trợ chuyển qua mail mới trên hợp đồng wifi không ạ.?",Việc sử dụng gói cước ưu đãi không ảnh hưởng bởi việc chuyển đổi account. Người dùng có thể liên hệ tổng đài 19006600 để được hỗ trợ việc thay đổi email trên hợp đồng Internet của mình
Bao giờ thì tôi có account mới đây,"Account mới sẽ được gửi đến người dùng bắt đầu từ ngày 08/05/2023. Nếu có nhu cầu đặc biệt cần cấp sớm hơn, có thể tạo ticket với nhân sự để được active sớm"
Của tôi trước là gói E3 sao giờ lại là E1,"Nhân viên FTEL được cung cấp các gói email Office 365 là E0, E1, E3 hoặc email Exchange local. Tùy theo yêu cầu công việc, cấp bậc và số lượng license còn lại, FHR sẽ quyết định việc phân bổ gói Office 365 phù hợp. Nếu còn thắc mắc về gói Office 365 của mình thì bạn có thể liên hệ admin hoặc cán bộ HCNS đơn vị."
"tôi có được cung cấp đầy đủ thông tin về quy trình chuyển đổi từ @fpt.com.vn sang @fpt.com không?
","FTEL sẽ có các thông tin truyền thông và hướng dẫn chuyển đổi sang fpt.com cho người dùng trên kênh chính thức FoxNews. Mọi hỗ trợ kỹ thuật vui lòng liên hệ qua WorkChat ""FTEL IT Support"" tại https://fpt.workplace.com/chat/t/106694372414376"
"sao trong mailbox của tôi chỉ có mail năm 2023, email cũ đâu hết rồi?","Các email năm 2023 sẽ được chuyển trước để người dùng thuận tiện làm việc. Email trước đó sẽ được chuyển dần trong 2 tháng tiếp theo. Trong thời gian chuyển đổi, người dùng có thể login vào account cũ để xem lại các mail chưa được chuyển và gửi email từ địa chỉ cũ nếu cần. Phần calendar và rule mail người dùng chủ động tạo lại từ đầu."
Các dữ liệu mail của tôi có được đồng bộ từ email cũ sang email mới không?,"Các email năm 2023 sẽ được chuyển trước để người dùng thuận tiện làm việc. Email trước đó sẽ được chuyển dần trong 2 tháng tiếp theo. Trong thời gian chuyển đổi, người dùng có thể login vào account cũ để xem lại các mail chưa được chuyển và gửi email từ địa chỉ cũ nếu cần. Phần calendar và rule mail người dùng chủ động tạo lại từ đầu."
Tài khoản cũ có còn sử dụng được nữa không ?,"Email gửi vào địa chỉ cũ (fpt.com.vn) sẽ được duy trì forward sang địa chỉ mới (fpt.com) đến 13/9/2025. Sau mốc này thì tập đoàn chưa có thông tin chính thức về việc duy trì địa chỉ cũ.Với các ứng dụng đã hoàn tất chuyển đổi xác thực, người dùng sử dụng account mới để đăng nhập. Các ứng dụng chưa hoàn tất chuyển đổi vui lòng đăng nhập bằng account cũ. Danh sách các ứng dựng có thể đăng nhập bằng account FPT.COM cập nhật tại đây...."
"Toàn bộ file dữ liệu được lưu trên trang fptcloud-my.sharepoint.com, hay tài khoản O365 sẽ được đồng bộ như nào? Người dùng có cần tải về backup ở máy hay không?","Ngoài email, toàn bộ dữ liệu trên Office365 sẽ không được tự động chuyển, bạn cần chủ động thực hiện việc chuyển đổi data này theo hướng dẫn. Vui long tham khảo hướng dẫn tại đây https://"
Sau này (sau hơn 2 năm) các email gửi tới @fpt.com.vn có được gửi về @fpt.com không ạ?,Email gửi vào địa chỉ cũ (fpt.com.vn) sẽ được duy trì forward sang địa chỉ mới (fpt.com) đến 13/9/2025. Sau mốc này thì tập đoàn chưa có thông tin chính thức về việc duy trì địa chỉ cũ.
cấu hình chuyển đổi fpt.com.vn sang fpt.com như thế nào?,"Email fpt.com.vn sẽ được chuyển đổi sang email fpt.com trước khi bàn giao đến anh/chị. Các ứng dụng khác trên Office 365, anh/chị vui lòng thực hiện backup data theo như hướng dẫn đã được truyền thông"
Cần làm gì để chuyển đổi account fpt.com.vn sang fpt.com?,"Email fpt.com.vn sẽ được chuyển đổi sang email fpt.com trước khi bàn giao đến anh/chị. Các ứng dụng khác trên Office 365, anh/chị vui lòng thực hiện backup data theo như hướng dẫn đã được truyền thông"
Các rule trong outlook tôi tạo đâu hết rồi?,"Các email năm 2023 sẽ được chuyển trước để người dùng thuận tiện làm việc. Email trước đó sẽ được chuyển dần trong 2 tháng tiếp theo. Trong thời gian chuyển đổi, người dùng có thể login vào account cũ để xem lại các mail chưa được chuyển và gửi email từ địa chỉ cũ nếu cần. Phần calendar và rule mail người dùng chủ động tạo lại từ đầu."
làm sao để chuyển dữ liệu trên trang sharepoint của nhóm?,"Vui lòng tập hợp danh sách các trang sharepoint và gửi về trưởng bộ phận/đơn vị. Trưởng bộ phận, đơn vị liên hệ với bộ phận IT để nhận được phương án hỗ trợ."
Cho em hỏi dữ liệu của Onedrive trên MS vẫn được đồng bộ qua gg space đúng không ạ?,Dữ liệu trên OneDrive cá nhân sẽ do người dùng chủ động thực hiện. Hiện tại chưa có tool migrate việc phân quyền này nên người dùng tự đối chiếu phân quyền cũ và cấu hình phân quyền truy nhập File/folder cho OneDrive/ Google Drive mới. Tham khảo hướng dẫn chuyển dữ liệu OneDrive sang account mới tại ....
Sau khi đổi thì không đủ mail thì như thế nào các anh?,"Các email năm 2023 sẽ được chuyển trước để người dùng thuận tiện làm việc. Email trước đó sẽ được chuyển dần trong 2 tháng tiếp theo. Trong thời gian chuyển đổi, người dùng có thể login vào account cũ để xem lại các mail chưa được chuyển và gửi email từ địa chỉ cũ nếu cần. Phần calendar và rule mail người dùng chủ động tạo lại từ đầu."
"Có mất mail, calendar không các anh?","Các email năm 2023 sẽ được chuyển trước để người dùng thuận tiện làm việc. Email trước đó sẽ được chuyển dần trong 2 tháng tiếp theo. Trong thời gian chuyển đổi, người dùng có thể login vào account cũ để xem lại các mail chưa được chuyển và gửi email từ địa chỉ cũ nếu cần. Phần calendar và rule mail người dùng chủ động tạo lại từ đầu."
Việc chuyển đổi có ảnh hưởng đến các hệ thống đã sử dụng account cũ không?,"Với các ứng dụng đã hoàn tất chuyển đổi xác thực, người dùng sử dụng account mới để đăng nhập. Các ứng dụng chưa hoàn tất chuyển đổi vui lòng đăng nhập bằng account cũ."
"dạ hiện tại em cũng dùng mail fpt.com.vn để đăng ký các dịch khác như offensive, ... để lấy các thông tin, dịch vụ. Vậy chuyển đổi qua mail mới fpt.com thì thì cty có chuyển đổi về luôn không ạ.
Ví dụ: trên trang offensive em quên mật khẩu nhấn reset password thì mail mới fpt.com có nhận thông báo không ạ, hay là mail cũạ?",Các mail gửi đến account cũ vẫn forward sang account mới. Tuy nhiên sau khi việc chuyển đổi hoàn tất người dùng nên đổi lại account mới trên các trang đăng ký dịch vụ.
Sao tôi lại bị đổi tên hu hu?,"Việc đổi tên để tránh trùng account của các công ty thành viên, đã được FHR và ban công nghệ thông tin của tập đoàn thống nhất. Có khoảng 3% email sẽ bị thay đổi số thứ tự trong đợt này do bị trùng. Thông tin chính thức FTEL.FHR sẽ gửi cho bạn khi bàn giao account mới."
"Tôi không thích account mới, có dùng tiếp account cũ được không?","Với các ứng dụng đã hoàn tất chuyển đổi xác thực, người dùng sử dụng account mới để đăng nhập. Các ứng dụng chưa hoàn tất chuyển đổi vui lòng đăng nhập bằng account cũ. Danh sách các ứng dựng có thể đăng nhập bằng account FPT.COM cập nhật tại đây...."
Tài khoản của tôi là gì trên hệ thống @fpt.com?,"Account mới sẽ được gửi đến người dùng bắt đầu từ ngày 08/05/2023. Nếu có nhu cầu đặc biệt cần cấp sớm hơn, có thể tạo ticket với nhân sự để được active sớm"
Tại sao nhiều mail cũ của tôi tự nhiên lại thành trạng thái chưa đọc (unread)?,"Nhiều email cũ của anh/chị bị chuyển trạng thái từ read -> unread có thể do 1 số lí do sau:
- Do tính năng chuyển tiếp được tự động bật trước khi người dùng nhận được thông tin account mới để tránh bị sót mail trong quá trình chuyển đổi.
- Do thay đổi cấu trúc thư mục của email, quá trình update trạng thái read/unread của mail server
- Do lỗi phát sinh trong quá trình chuyển đổi từ hệ thống mail cũ sang hệ thống mail mới"
Cấu trúc các thư mục trong email mới có giống với email cũ không?,"Cấu trúc thư mục được giữ nguyên. Tuy nhiên nếu trong thời gian chuyển đổi, người dùng thay đổi cấu trúc thư mục/hoặc xoá mail trên account cũ, hệ thống có thể không cập nhật được."
Những hệ thống sử dụng email cũ có hoạt động với email mới hay không ?,"Với các ứng dụng đã hoàn tất chuyển đổi xác thực, người dùng sử dụng account mới để đăng nhập. Các ứng dụng chưa hoàn tất chuyển đổi vui lòng đăng nhập bằng account cũ. Danh sách các ứng dựng có thể đăng nhập bằng account FPT.COM cập nhật tại đây...."
Cho em hỏi có cập nhật lại số thứ tự trong email không ạ?,"Việc đổi tên để tránh trùng account của các công ty thành viên, đã được FHR và ban công nghệ thông tin của tập đoàn thống nhất. Có khoảng 3% email sẽ bị thay đổi số thứ tự trong đợt này do bị trùng. Thông tin chính thức FTEL.FHR sẽ gửi cho bạn khi bàn giao account mới."
Việc chuyển đổi có bị mất email cũ không?,"Các email năm 2023 sẽ được chuyển trước để người dùng thuận tiện làm việc. Email trước đó sẽ được chuyển dần trong 2 tháng tiếp theo. Trong thời gian chuyển đổi, người dùng có thể login vào account cũ để xem lại các mail chưa được chuyển và gửi email từ địa chỉ cũ nếu cần. Phần calendar và rule mail người dùng chủ động tạo lại từ đầu."
VPN sẽ đăng nhập bằng account nào nhỉ?,"Việc login VPN bằng account fpt.com hiện tại chưa sẵn sàng, vui lòng đăng nhập VPN bằng account cũ cho đến khi có thông báo mới."
Khi gặp lỗi cấu hình thì cần làm gì?,Vui lòng cung cấp thông tin cụ thể hơn. Ví dụ không đăng nhập được workplace bằng tài khoản mới/ Không đăng nhập được VPN bằng tài khoản mới.
Có hướng dẫn sử dụng Workspace không các anh?,"Hướng dẫn login Workplace/Workchat bằng account mới:

- Khi nhận được email fpt.com là bạn sẽ bị phải login Workchat/Workplace bằng account mới
- Bạn mở trình duyệt và truy nhập vào https://office.com/
- Bấm vào avatar của bạn ở góc trên bên phải, chọn ""Sign in with a different account""
- Bạn sẽ log in bằng account mới thành công
- Bạn mở tab mới trên trình duyệt web đó, truy nhập vào https://fpt.workplace.com/ để đăng nhập với account mới
Dữ liệu WorkChat là nội dung chat sẽ được chuyển tự động và gán đúng cho user account mới của từng người. Về cơ bản, user chỉ thay đổi xác thực bằng account email mới, dữ liệu chat vẫn được giữ nguyên."
"Account mới dùng làm gì nhỉ, có dùng song song cả 2 được không?","Bạn có thể dùng song song 2 account đến 13/9/2023. Sau mốc thời gian đó account cũ (fpt.com.vn) sẽ không gửi ra ngoài được nữa. Nếu vì lý do đặc biệt, bạn cần duy trì việc gửi ra từ account cũ, vui lòng liên hệ nhân sự để được cấp quyền (tạo ticket SSC)"
"Tôi có đồng bộ danh bạ và các thiết lập Email của người dùng sang tài khoản @fpt.com chưa?
","Các email năm 2023 sẽ được chuyển trước để người dùng thuận tiện làm việc. Email trước đó sẽ được chuyển dần trong 2 tháng tiếp theo. Trong thời gian chuyển đổi, người dùng có thể login vào account cũ để xem lại các mail chưa được chuyển và gửi email từ địa chỉ cũ nếu cần. Phần calendar và rule mail người dùng chủ động tạo lại từ đầu."
Tại sao có email tôi đã thả vào thư mục rồi mà nó vẫn nằm ở chỗ khác?,"Cấu trúc thư mục được giữ nguyên. Tuy nhiên nếu trong thời gian chuyển đổi, người dùng thay đổi cấu trúc thư mục trên account cũ, hệ thống có thể không cập nhật được."
Dung lượng lưu trữ trên email mới của tôi là bao nhiêu?,Dung lượng lưu trữ trên email mới tương đương với dung lượng trên email cũ
Những dịch vụ nào sẽ bị ảnh hưởng sau khi chuyển email ?,Tất cả những dịch vụ có sử dụng email làm phương thức xác thực đều sẽ bị ảnh hưởng bởi việc chuyển đổi này. 
"Tôi không đăng nhập được vào VPN bằng account mới, làm thế nào bây giờ","Việc login VPN bằng account fpt.com hiện tại chưa sẵn sàng, vui lòng đăng nhập VPN bằng account cũ cho đến khi có thông báo mới."
Khi có thắc mắc thì gặp ai trả lời?,Vui lòng cung cấp thông tin cụ thể hơn. Ví dụ không đăng nhập được workplace bằng tài khoản mới/ Không đăng nhập được VPN bằng tài khoản mới.
"Filter Rule mail, và các thư mục có bị mất không các anh !? Nếu mất thì ntn ạ","Các email năm 2023 sẽ được chuyển trước để người dùng thuận tiện làm việc. Email trước đó sẽ được chuyển dần trong 2 tháng tiếp theo. Trong thời gian chuyển đổi, người dùng có thể login vào account cũ để tra lại các mail chưa được chuyển. Phần calendar và rule mail người dùng chủ động tạo lại từ đầu."
"Tôi bị đổi tên, login vào inside có đổi theo không?",Inside không sử dụng account email để xác thực nên không bị ảnh hưởng.
"FPT đã thông báo đầy đủ về lịch trình chuyển đổi cho người dùng và các bên liên quan chưa?
","FTEL sẽ có các thông tin truyền thông và hướng dẫn chuyển đổi sang fpt.com cho người dùng trên kênh chính thức FoxNews. Mọi hỗ trợ kỹ thuật vui lòng liên hệ qua WorkChat ""FTEL IT Support"" tại https://fpt.workplace.com/chat/t/106694372414376"
Tại sao có email tôi xóa rồi sao bây giờ vẫn thấy ở đây nhỉ?,"Cấu trúc thư mục được giữ nguyên. Tuy nhiên nếu trong thời gian chuyển đổi, người dùng thay đổi cấu trúc thư mục/hoặc xoá mail trên account cũ, hệ thống có thể không cập nhật được."
Tôi có thể sử dụng đồng thời cả email cũ và email mới không? Nếu có thể thì trong bao lâu?,"Email gửi vào địa chỉ cũ (fpt.com.vn) sẽ được duy trì forward sang địa chỉ mới (fpt.com) đến 13/9/2025. Sau mốc này thì tập đoàn chưa có thông tin chính thức về việc duy trì địa chỉ cũ.Với các ứng dụng đã hoàn tất chuyển đổi xác thực, người dùng sử dụng account mới để đăng nhập. Các ứng dụng chưa hoàn tất chuyển đổi vui lòng đăng nhập bằng account cũ."
Email và tài liệu có trên email cũ sẽ xử lý như thế nào ?,"Các email năm 2023 sẽ được chuyển trước để người dùng thuận tiện làm việc. Email trước đó sẽ được chuyển dần trong 2 tháng tiếp theo. Trong thời gian chuyển đổi, người dùng có thể login vào account cũ để xem lại các mail chưa được chuyển và gửi email từ địa chỉ cũ nếu cần. Phần calendar và rule mail người dùng chủ động tạo lại từ đầu."
Tại sao email của tôi lại là Gmail?,Trong dự án chuyển đổi account fpt.com.vn sang fpt.com sẽ có một số đơn vị thuộc khối Công nghệ Hạ tầng sử dụng dịch vụ Google Workspace thay cho Office 365.
Nếu dữ liệu của em không đủ thì sao các anh?,"Các email năm 2023 sẽ được chuyển trước để người dùng thuận tiện làm việc. Email trước đó sẽ được chuyển dần trong 2 tháng tiếp theo. Trong thời gian chuyển đổi, người dùng có thể login vào account cũ để xem lại các mail chưa được chuyển và gửi email từ địa chỉ cũ nếu cần. Phần calendar và rule mail người dùng chủ động tạo lại từ đầu."
Tôi không nhận được thông báo password?,"Account mới sẽ được gửi đến người dùng bắt đầu từ ngày 08/05/2023. Nếu có nhu cầu đặc biệt cần cấp sớm hơn, có thể tạo ticket với nhân sự để được active sớm"
FPT đã cung cấp hỗ trợ kỹ thuật cho người dùng khi gặp vấn đề về tài khoản Email @fpt.com không?,"FTEL sẽ có các thông tin truyền thông và hướng dẫn chuyển đổi sang fpt.com cho người dùng trên kênh chính thức FoxNews. Mọi hỗ trợ kỹ thuật vui lòng liên hệ qua WorkChat ""FTEL IT Support"" tại https://fpt.workplace.com/chat/t/106694372414376"
Email cũ có gửi được ra nữa không?,Email gửi vào địa chỉ cũ (fpt.com.vn) sẽ được duy trì forward sang địa chỉ mới (fpt.com) đến 13/9/2025. Sau mốc này thì tập đoàn chưa có thông tin chính thức về việc duy trì địa chỉ cũ.
Tôi có thể liên hệ với ai để được giải đáp các thắc mắc liên quan đến email mới?,Anh/chị có thể gửi những thắc mắc liên quan đến email mới tại hệ thống chat bot này.
"Tôi không gửi được email ra bên ngoài (Yahoo, Gmail)","Ở thời điểm hiện tại có một số policy chưa cho  phép người dùng gửi mail đến các dịch vụ mail free như Yahoo, Gmail. Vui lòng tổng hợp danh sách các account chưa gửi được và thông tin lại cho cán bộ admin/HCNS nhân sự của từng đơn vị để báo ban nhân sự liên hệ FIM xử lý."
"Làm thế nào để reset authenticator, otp email?","Để reset authenticator của account fpt.com, anh/chị vui lòng tạo ticket trên SSC, mục Reset OTP Email để được hỗ trợ:
https://ssc.fpt.net/secure/SSC01CreateTicket.jspa?processId=1066&catalogId=11&issueKeys"
Làm thế nào để xem email cũ (fpt.com.vn)?,"Các email năm 2023 sẽ được chuyển trước để người dùng thuận tiện làm việc. Email trước đó sẽ được chuyển dần trong 2 tháng tiếp theo. Trong thời gian chuyển đổi, người dùng có thể login vào account cũ để tra lại các mail chưa được chuyển. Phần calendar và rule mail người dùng chủ động tạo lại từ đầu."
Account mới fpt.com của tôi đăng nhập vào Team không thấy gì cả?,"Do đặc thù của MS Teams và việc chuyển đổi này, nội dung chat của FPT và các CTTV (trừ FSoft) sẽ chỉ còn ở hệ thống cũ, FPT sẽ duy trì hệ thống này tới 13/09/2023. Cán bộ nhân viên chủ động copy dữ liệu về, tự tạo các group chat mới và duy trì công việc hiện tại"
Sao tôi đổi password mãi không được?,Vui lòng đọc kỹ hướng dẫn đổi mật khẩu cho account fpt.com tại: https://ess.fpt.com/account/change-password
Tôi không muốn forward email cũ sang hòm mail mới này nữa?,"Người dùng có thể dừng forward sang hòm mail mới như sau:
Đăng nhập vào tài khoản Outlook 365 bằng email cũ của bạn.
Nhấp vào biểu tượng bánh răng ở góc trên cùng bên phải của trang và chọn ""Xem tất cả các cài đặt Outlook"".
Chọn ""Email"" ở thanh bên trái.
Tìm và chọn ""Chuyển tiếp"".
Chọn ""Tắt chuyển tiếp"" và nhấp vào nút ""Lưu"" để lưu các thay đổi của bạn."
Onedrive của tôi không nhìn thấy các file?,Dữ liệu trên OneDrive cá nhân sẽ do người dùng chủ động thực hiện. Hiện tại chưa có tool migrate việc phân quyền này nên người dùng tự đối chiếu phân quyền cũ và cấu hình phân quyền truy nhập File/folder cho OneDrive/ Google Drive mới. Tham khảo hướng dẫn chuyển dữ liệu OneDrive sang account mới tại ....
Tôi đổi password rồi sao không login được vào email mới?,"Sau khi đổi password email, anh/chị vui lòng đợi từ 5-10 phút để hệ thống cập nhật cấu hình. Nếu vẫn không login được, anh/chị vui lòng gửi thông tin đến admin/cán bộ hành chính nhân sự của đơn vị để nhờ hỗ trợ reset lại password email của anh/chị."
Account mới của tôi không vào được Sharepoint để làm việc?,"Các dữ liệu trên Sharepoint sẽ được chuyển sang hệ thống mới sau. Trong giai đoạn này, bạn vui lòng dùng account cũ để làm việc trên Sharepoint. Admin của site Sharepoint sẽ liên hệ với IT để được hướng dẫn, hỗ trợ chuyển đổi."
Cài Outlook thế nào bây giờ nhỉ?,Việc cài đặt outlook giống như đã làm với account fpt.com.vn cũ
Tôi có thể giữ email cũ fpt.com.vn trong bao lâu,Bạn có thể giữ email fpt.com.vn trong thời hạn 6 tháng kể từ ngày nhận được email fpt.com
Email mới login trên điện thoại không được. Phải làm sao,"Vui lòng đăng nhập thử trên webmail trước bằng URL sau: https://portal.office.com/.
Sau đó thử cấu hình lại account mới trên điện thoại."
"Tôi không login được vào các ứng dụng ePayment, ePurchase, myFPT, SSC, ticket, SCM, FTELSCM...","Sau khi chuyển đổi account, nếu không login được các dịch vụ/ứng dụng như ePayment, ePurchase, myFPT, SSC, ticket, SCM, FTELSCM... anh/chị vui lòng liên hệ quản trị viên của các dịch vụ/ứng dụng trên để được hỗ trợ."
Hiện em vẫn chưa nhận được mail báo chuyển đổi sang domain mới. Anh/chị check giúp em với ạ.,"Account mới sẽ được gửi đến người dùng bắt đầu từ ngày 08/05/2023. Nếu có nhu cầu đặc biệt cần cấp sớm hơn, có thể tạo ticket với nhân sự để được active sớm"
Hiện tại account mới của mình không login được Office 365 nhờ anh chị support giúp ạ.,"Vui lòng kiểm tra đúng user và password mới trước khi đăng nhập.

- Mở trình duyệt và truy nhập vào https://office.com/
- Bấm vào avatar của bạn ở góc trên bên phải, chọn ""Sign in with a different account""
- Log in lại bằng account mới
"
Em nhập đúng mật khẩu mà không vào được !? Liên hệ ai thế các anh,"Vui lòng kiểm tra đúng user và password mới trước khi đăng nhập.

- Mở trình duyệt và truy nhập vào https://office.com/
- Bấm vào avatar của bạn ở góc trên bên phải, chọn ""Sign in with a different account""
- Log in lại bằng account mới
"
"Hiện tại account mới của mình không login được nhờ anh chị support giúp ạ.
","Vui lòng kiểm tra đúng user và password mới trước khi đăng nhập.

- Mở trình duyệt và truy nhập vào https://office.com/
- Bấm vào avatar của bạn ở góc trên bên phải, chọn ""Sign in with a different account""
- Log in lại bằng account mới
"
